{
  "release_id": "v0.8.0",
  "release_title": "v0.8.0 — M9 Decision Proof Runtime Replay and Governance CI Expansion",
  "tracker_issue": "#93",
  "closing_prs": [
    {
      "pr": "#94",
      "title": "Add M9 Decision Proof runtime replay and governance CI pattern",
      "merged": true
    },
    {
      "pr": "#103",
      "title": "Update README for v0.8.0 M9 completion",
      "merged": true
    }
  ],
  "release_tag": {
    "tag": "v0.8.0",
    "present": true
  },
  "readme_version_status": {
    "version": "v0.8.0",
    "present": true,
    "status_text": "M1, M2, M3, M4, M5, M6, M7, M8, and M9 are complete."
  },
  "release_title_consistency": {
    "readme_title": "v0.8.0 — M9 Decision Proof Runtime Replay and Governance CI Expansion",
    "release_title": "v0.8.0 — M9 Decision Proof Runtime Replay and Governance CI Expansion",
    "matches": true
  },
  "release_body_consistency": {
    "governance_boundary_preserved": true,
    "body_summary": "Runtime replay, CI checks, release proof automation, adapter events, evaluator outputs, and replay packets are evidence-producing systems, not authorities."
  },
  "next_phase_declaration": {
    "expected": "M10 — Decision Proof Sealing Boundary and External Integration Readiness",
    "actual": "M10 — Decision Proof Sealing Boundary and External Integration Readiness",
    "matches_expected": true
  },
  "decision_proof_replay_packet": {
    "packet_ref": "examples/decision-proof-runtime-replay/release-governance-replay.json",
    "present": true,
    "replay_ready": true
  },
  "governance_boundary_preservation": {
    "preserved": true,
    "aaos_retained_authority": [
      "purpose_and_business_intent",
      "risk_appetite",
      "approval_doctrine",
      "identity_trust_chain",
      "policy_authority",
      "decision_router_logic",
      "escalation_semantics",
      "fail_closed_policy",
      "rollback_policy",
      "final_risk_classification",
      "decision_proof_sealing_logic",
      "audit_final_judgment",
      "final_governance_authority"
    ]
  },
  "automation_checks": {
    "readme_version_status": true,
    "tracker_issue_closure": true,
    "pr_merge_status": true,
    "release_tag_presence": true,
    "release_title_consistency": true,
    "release_body_consistency": true,
    "next_phase_declaration": true,
    "decision_proof_replay_packet_presence": true,
    "governance_boundary_preservation": true
  },
  "evaluator_outputs": [
    "replay_packet_valid",
    "replay_packet_invalid",
    "replay_findings",
    "missing_evidence",
    "authority_boundary_violation",
    "release_proof_consistency_passed",
    "release_proof_consistency_failed",
    "review_required",
    "escalation_required",
    "fail_closed_recommended"
  ],
  "not_authority_statement": "Release proof automation may prepare auditable release evidence but must not approve, block, classify, roll back, publish releases, seal Decision Proof, close audits, or make final governance judgments.",
  "sovereignty_statement": "AAOS retains purpose and business intent, risk appetite, approval doctrine, identity trust chain, policy authority, decision router logic, escalation semantics, fail-closed policy, rollback policy, final risk classification, Decision Proof sealing logic, audit final judgment, and final governance authority."
}
